{
  "task": {
    "task_id": "task_demo",
    "goal_revision": 1,
    "status": "succeeded",
    "required_requirement_ids": [
      "quality",
      "file_saved"
    ],
    "tenant_id": "tenant_demo"
  },
  "result": {
    "task_id": "task_demo",
    "goal_revision": 1,
    "artifact_refs": [
      {
        "tenant_id": "tenant_demo",
        "owner_id": "orchestrator_demo",
        "content_id": "report_demo",
        "version": "1",
        "hash": "sha256:aaaaaaaaaaaaaaaaaaaaaaaaaaaaaaaaaaaaaaaaaaaaaaaaaaaaaaaaaaaaaaaa",
        "media_type": "text/markdown",
        "byte_length": 128
      }
    ],
    "completion_basis": "user_accepted",
    "condition_results": [
      {
        "requirement_id": "quality",
        "goal_revision": 1,
        "artifact_ref": {
          "tenant_id": "tenant_demo",
          "owner_id": "orchestrator_demo",
          "content_id": "report_demo",
          "version": "1",
          "hash": "sha256:aaaaaaaaaaaaaaaaaaaaaaaaaaaaaaaaaaaaaaaaaaaaaaaaaaaaaaaaaaaaaaaa",
          "media_type": "text/markdown",
          "byte_length": 128
        },
        "verdict": "pass",
        "basis": "user_accepted",
        "evidence_refs": [
          {
            "tenant_id": "tenant_demo",
            "owner_id": "orchestrator_demo",
            "content_id": "evidence_demo",
            "version": "1",
            "hash": "sha256:bbbbbbbbbbbbbbbbbbbbbbbbbbbbbbbbbbbbbbbbbbbbbbbbbbbbbbbbbbbbbbbb",
            "media_type": "text/markdown",
            "byte_length": 128
          }
        ],
        "evaluator_ref": {
          "id": "verifier_demo",
          "version": "1",
          "digest": "sha256:cccccccccccccccccccccccccccccccccccccccccccccccccccccccccccccccc"
        }
      },
      {
        "requirement_id": "file_saved",
        "goal_revision": 1,
        "artifact_ref": {
          "tenant_id": "tenant_demo",
          "owner_id": "orchestrator_demo",
          "content_id": "report_demo",
          "version": "1",
          "hash": "sha256:aaaaaaaaaaaaaaaaaaaaaaaaaaaaaaaaaaaaaaaaaaaaaaaaaaaaaaaaaaaaaaaa",
          "media_type": "text/markdown",
          "byte_length": 128
        },
        "verdict": "pass",
        "basis": "verified",
        "evidence_refs": [
          {
            "tenant_id": "tenant_demo",
            "owner_id": "orchestrator_demo",
            "content_id": "evidence_demo",
            "version": "1",
            "hash": "sha256:bbbbbbbbbbbbbbbbbbbbbbbbbbbbbbbbbbbbbbbbbbbbbbbbbbbbbbbbbbbbbbbb",
            "media_type": "text/markdown",
            "byte_length": 128
          }
        ],
        "evaluator_ref": {
          "id": "verifier_demo",
          "version": "1",
          "digest": "sha256:cccccccccccccccccccccccccccccccccccccccccccccccccccccccccccccccc"
        }
      }
    ],
    "limitations": [
      "研究质量依赖声明的评估方法，文件保存有客观证据。"
    ],
    "completed_at": "2026-09-25T15:00:00Z"
  },
  "operations": [
    {
      "operation_id": "write_demo",
      "execution_state": "closed",
      "effect": "applied",
      "may_apply_later": false
    }
  ],
  "accounting_open": [
    "model_bill_demo"
  ]
}
